Sheet: ATTiny amps measurement
A1: Voltage on shunt read on scope Volts | B1: resistor Ohm | C1: Amps
A2: 0.5 | B2: 1000 | C2: of:=[.A2]/[.B2] -> 0.0005
A3: 0.015 | B3: 1000 | C3: of:=[.A3]/[.B3] -> 0.000015
A4: 1.2 | B4: 1000 | C4: of:=[.A4]/[.B4] -> 0.0012
A5: 0.55 | B5: 1000 | C5: of:=[.A5]/[.B5] -> 0.00055 | D5: Simple program no sleep
A6: 0.005 | B6: 1000 | C6: of:=[.A6]/[.B6] -> 0.000005 | D6: Deep Sleep ADC Turned off â€“ 5uA | E6: There is about 2.5mV +- in it
A7: 0 | B7: 1000 | C7: 0 | D7: Without WDT current is below measure level but not very useful
D8: Ultra low power external timer could be the solution to further reduce power consumption. Eg: https://www.ti.com/product/TPL5010#
A9: Voltage on load
A10: 3.3 | B10: 470000 | C10: of:=[.A10]/[.B10] -> 0.00000702127659574468

Sheet: ampsVStime
A2: CR2032 | B2: 235 | C2: mAh
B6: uA in sleep | C6: years of sleep on a single CR2032
B7: 1 | C7: of:=[.$B$2]*1000/24/365/[.B7] -> 26.8264840182648
B8: 10 | C8: of:=[.$B$2]*1000/24/365/[.B8] -> 2.68264840182648

Sheet: Wireless tempsensor Circuit1
A1: 1 measurement every 2 seconds + 1 short LED flash
A2: T: 0:00 | B2: 2.6V | C2: 22C | D2: 2019.oct.19
A3: T: 10:;46 | B3: 2.47V | C3: 17C
A4: T: 19:00 | B4: 2.47V | C4: 17,4C | D4: Problem with the reading! See log file!
A5: T: d1 9:00 | B5: 2.46V | C5: 12,5C
A6: T d1 23:00 | B6: 2.46V | C6: 14,5C
A7: T d2 13:35 | B7: 2.45V | C7: 23,0C
A8: T d2 21:00 | B8: 2.45V | C8: 15,6C
A9: T d3 02:45 | B9: 2.45V | C9: 21,5C | D9: Second reincarnation of the circuit with ATTiny25

Sheet: Wireless tempsensor Circuit2
A1: ATTiny25 | B1: Readout | C1: Volts | D1: Temp | E1: Volts counted
A2: 1 measurement every 2 seconds no LED, 18650B self measure battery
A4: 2019.11.08
A5: Kalibracio 16:11-kor | B5: 24320 | C5: 2.973
B6: 21888 | C6: 3.301
B7: 17408 | C7: 4.111
A9: Elemrol inditva | B9: 18304 | C9: 3.927 | D9: 22.6 | E9: of:=[.$C$9]*[.$B$9]/[.B9] -> 3.927
A10: 2019.11.14. 22:51 | B10: 18688 | E10: of:=[.$C$9]*[.$B$9]/[.B10] -> 3.84630821917808
B11: 18752 | E11: of:=[.$C$9]*[.$B$9]/[.B11] -> 3.83318088737201
A12: 2019.11.14. 21:07 | B12: 18816 | E12: of:=[.$C$9]*[.$B$9]/[.B12] -> 3.82014285714286